{
  "$schema": "https://json-schema.org/draft/2020-12/schema",
  "$id": "https://schemas.rawframe.net/baseline-record-v1.schema.json",
  "title": "Rawframe BaselineRecord, generation 1",
  "description": "The fourth and last authority of the ADR-0019 chain, per SPEC-0014. It is a reviewed promotion pointer to one passing Evaluation Receipt, authored by a human review action and never emitted by a tool. This generation has a schema and a reader and no writer: the generation that admits a writer is a later generation with a trusted builder behind it. Because the shared trust definition pins provenance to diagnostic_untrusted, no record this schema admits can be a real promotion, which is the intended ceiling rather than a limitation to be worked around.",
  "type": "object",
  "additionalProperties": false,
  "required": [
    "schemaVersion",
    "recordKind",
    "baselineId",
    "role",
    "tier",
    "compatibility",
    "promoted",
    "source",
    "predecessor",
    "promotion",
    "affected",
    "headroom",
    "retention",
    "status",
    "claimScope",
    "trust"
  ],
  "properties": {
    "schemaVersion": {
      "const": 1
    },
    "recordKind": {
      "const": "baseline_record"
    },
    "baselineId": {
      "$ref": "evidence-common-v1.schema.json#/$defs/uuid"
    },
    "role": {
      "description": "SPEC-0014's two roles and nothing else. A role is fixed at authoring; a record whose role changed is a different record with a successor pointing at it.",
      "enum": [
        "anchor",
        "rolling_main"
      ]
    },
    "tier": {
      "description": "Tier 0 is the only tier this gate can produce, so it is the only tier a record here can name. Canonical Tier-2 evidence requires a qualified cell that does not exist yet, and admitting the value it would carry would be a future flag with nothing behind it.",
      "const": "tier_0"
    },
    "compatibility": {
      "description": "SPEC-0014's exact compatibility key. Every dimension must match exactly for a comparison to mean anything, so each is named here rather than summarized into one opaque hash that hides which dimension moved.",
      "type": "object",
      "additionalProperties": false,
      "required": [
        "profileId",
        "workloadId",
        "targetId",
        "closureFingerprint",
        "toolchainFingerprint",
        "harnessFingerprint",
        "cellFingerprint",
        "metricRegistryGeneration",
        "policyGeneration",
        "evaluatorGeneration"
      ],
      "properties": {
        "profileId": {
          "$ref": "evidence-common-v1.schema.json#/$defs/identifier"
        },
        "workloadId": {
          "$ref": "evidence-common-v1.schema.json#/$defs/identifier"
        },
        "targetId": {
          "$ref": "evidence-common-v1.schema.json#/$defs/identifier"
        },
        "closureFingerprint": {
          "$ref": "evidence-common-v1.schema.json#/$defs/fingerprint"
        },
        "toolchainFingerprint": {
          "$ref": "evidence-common-v1.schema.json#/$defs/fingerprint"
        },
        "harnessFingerprint": {
          "$ref": "evidence-common-v1.schema.json#/$defs/fingerprint"
        },
        "cellFingerprint": {
          "description": "The ADR-0020 benchmark cell this evidence came from. A local developer machine is not a cell, which is one more reason a record at this tier cannot be promoted.",
          "$ref": "evidence-common-v1.schema.json#/$defs/fingerprint"
        },
        "metricRegistryGeneration": {
          "$ref": "evidence-common-v1.schema.json#/$defs/nonNegativeInteger"
        },
        "policyGeneration": {
          "$ref": "evidence-common-v1.schema.json#/$defs/nonNegativeInteger"
        },
        "evaluatorGeneration": {
          "type": "integer",
          "minimum": 1,
          "maximum": 65535
        }
      }
    },
    "promoted": {
      "description": "What is being pointed at, by descriptor rather than by path or name. A human-readable name may resolve to an immutable digest but is never the authority.",
      "type": "object",
      "additionalProperties": false,
      "required": [
        "evaluationReceipt",
        "evidenceSet",
        "aggregateVerdict"
      ],
      "properties": {
        "evaluationReceipt": {
          "$ref": "evidence-common-v1.schema.json#/$defs/descriptor"
        },
        "evidenceSet": {
          "$ref": "evidence-common-v1.schema.json#/$defs/descriptor"
        },
        "aggregateVerdict": {
          "description": "Fixed. SPEC-0014 admits promotion only of a passing aggregate verdict, so a record naming any other value is not a weaker promotion, it is not a promotion.",
          "const": "passed"
        }
      }
    },
    "source": {
      "description": "The candidate's own identity. Kept separate from the review identity below so that a promotion arriving inside the change it approves is visible rather than implied.",
      "type": "object",
      "additionalProperties": false,
      "required": [
        "revision",
        "buildFingerprint",
        "closureFingerprint"
      ],
      "properties": {
        "revision": {
          "$ref": "evidence-common-v1.schema.json#/$defs/fingerprint"
        },
        "buildFingerprint": {
          "$ref": "evidence-common-v1.schema.json#/$defs/fingerprint"
        },
        "closureFingerprint": {
          "$ref": "evidence-common-v1.schema.json#/$defs/fingerprint"
        }
      }
    },
    "predecessor": {
      "description": "The chain, stated one way or the other and never left to inference. Exactly one of an explicit first-baseline marker and a predecessor descriptor is present, so a broken chain is a refusal rather than a record that reads as a beginning.",
      "type": "object",
      "additionalProperties": false,
      "properties": {
        "firstBaseline": {
          "const": true
        },
        "descriptor": {
          "$ref": "evidence-common-v1.schema.json#/$defs/descriptor"
        },
        "chain": {
          "description": "Earlier records in role order, newest first. Bounded because a chain nobody can read is a chain nobody checks.",
          "type": "array",
          "maxItems": 32,
          "items": {
            "$ref": "evidence-common-v1.schema.json#/$defs/descriptor"
          }
        }
      },
      "oneOf": [
        {
          "required": [
            "firstBaseline"
          ],
          "not": {
            "required": [
              "descriptor"
            ]
          }
        },
        {
          "required": [
            "descriptor"
          ],
          "not": {
            "required": [
              "firstBaseline"
            ]
          }
        }
      ]
    },
    "promotion": {
      "description": "The reviewed human act. Every member here is authored, which is why this tool validates the record and never produces one: it carries a clock and a named person, and a deterministic emitter can honestly supply neither.",
      "type": "object",
      "additionalProperties": false,
      "required": [
        "reason",
        "approvalAuthority",
        "approvingProjectOwner",
        "approvalTimestamp",
        "reviewReference",
        "protectedChangeReference"
      ],
      "properties": {
        "reason": {
          "type": "string",
          "minLength": 1,
          "maxLength": 512
        },
        "approvalAuthority": {
          "description": "Fixed. SPEC-0016 reserves this act to the project owner, and an enum with a second member would be the beginning of an agent-approvable path.",
          "const": "project_owner"
        },
        "approvingProjectOwner": {
          "type": "string",
          "minLength": 1,
          "maxLength": 128
        },
        "approvalTimestamp": {
          "description": "RFC 3339 UTC, seconds resolution, Z only. Offsets and fractional seconds are refused because two spellings of one instant are two byte sequences for one record.",
          "type": "string",
          "pattern": "^[0-9]{4}-[0-9]{2}-[0-9]{2}T[0-9]{2}:[0-9]{2}:[0-9]{2}Z$"
        },
        "reviewReference": {
          "$ref": "evidence-common-v1.schema.json#/$defs/fingerprint"
        },
        "protectedChangeReference": {
          "$ref": "evidence-common-v1.schema.json#/$defs/fingerprint"
        }
      }
    },
    "affected": {
      "description": "What this baseline is a reference for. A promotion that names no metric is a promotion of nothing and is refused rather than treated as covering everything.",
      "type": "object",
      "additionalProperties": false,
      "required": [
        "metrics",
        "claims"
      ],
      "properties": {
        "metrics": {
          "type": "array",
          "minItems": 1,
          "maxItems": 64,
          "items": {
            "$ref": "evidence-common-v1.schema.json#/$defs/identifier"
          }
        },
        "claims": {
          "type": "array",
          "maxItems": 64,
          "items": {
            "$ref": "evidence-common-v1.schema.json#/$defs/identifier"
          }
        }
      }
    },
    "headroom": {
      "description": "How much room is left against what this record is a reference for. Absolute headroom is against a ceiling or objective; relative headroom is against another baseline and is unavailable before ADR-0020 cell qualification, which is why an entry of that kind at this tier is refused rather than reported as zero.",
      "type": "object",
      "additionalProperties": false,
      "required": [
        "absolute",
        "relative"
      ],
      "properties": {
        "absolute": {
          "type": "array",
          "maxItems": 64,
          "items": {
            "$ref": "#/$defs/headroomEntry"
          }
        },
        "relative": {
          "type": "array",
          "maxItems": 64,
          "items": {
            "$ref": "#/$defs/headroomEntry"
          }
        }
      }
    },
    "retention": {
      "description": "When this record is reviewed again and when its required attachments stop being kept. SPEC-0014 requires that ending retention deliberately produce a successor authority rather than an active baseline whose evidence has quietly gone.",
      "type": "object",
      "additionalProperties": false,
      "required": [
        "reviewBy",
        "attachmentsRetainedUntil"
      ],
      "properties": {
        "reviewBy": {
          "$ref": "#/$defs/timestamp"
        },
        "attachmentsRetainedUntil": {
          "$ref": "#/$defs/timestamp"
        }
      }
    },
    "status": {
      "description": "The status relationship, not a mutable field. A record never stops being active by being edited; a later immutable record supersedes or revokes it, and this record names that successor once it exists.",
      "type": "object",
      "additionalProperties": false,
      "required": [
        "state"
      ],
      "properties": {
        "state": {
          "enum": [
            "active",
            "superseded",
            "revoked"
          ]
        },
        "successor": {
          "$ref": "evidence-common-v1.schema.json#/$defs/descriptor"
        }
      }
    },
    "claimScope": {
      "description": "What validating this record does not mean. Every member is fixed false by the schema rather than by convention, for the same reason the EvaluationReceipt carries one: a promotion record is exactly the artifact that gets quoted out of context, and it has to argue against that reading in its own bytes.",
      "type": "object",
      "additionalProperties": false,
      "required": [
        "promotionEffectiveClaim",
        "activeBaselineClaim",
        "trustedProvenanceClaim",
        "relativeComparisonClaim",
        "runnerQualificationClaim",
        "performanceClaim"
      ],
      "properties": {
        "promotionEffectiveClaim": {
          "const": false
        },
        "activeBaselineClaim": {
          "const": false
        },
        "trustedProvenanceClaim": {
          "const": false
        },
        "relativeComparisonClaim": {
          "const": false
        },
        "runnerQualificationClaim": {
          "const": false
        },
        "performanceClaim": {
          "const": false
        }
      }
    },
    "trust": {
      "$ref": "evidence-common-v1.schema.json#/$defs/trust"
    }
  },
  "$defs": {
    "timestamp": {
      "type": "string",
      "pattern": "^[0-9]{4}-[0-9]{2}-[0-9]{2}T[0-9]{2}:[0-9]{2}:[0-9]{2}Z$"
    },
    "headroomEntry": {
      "type": "object",
      "additionalProperties": false,
      "required": [
        "metricId",
        "margin"
      ],
      "properties": {
        "metricId": {
          "$ref": "evidence-common-v1.schema.json#/$defs/identifier"
        },
        "margin": {
          "$ref": "#/$defs/scaledValue"
        }
      }
    },
    "scaledValue": {
      "description": "SPEC-0017's fixed-point subset, the same pair the EvaluationReceipt uses. A fractional margin is carried exactly by an integer pair and never by a float.",
      "type": "object",
      "additionalProperties": false,
      "required": [
        "value",
        "scaleExponent"
      ],
      "properties": {
        "value": {
          "$ref": "evidence-common-v1.schema.json#/$defs/safeInteger"
        },
        "scaleExponent": {
          "type": "integer",
          "minimum": -18,
          "maximum": 18
        }
      }
    }
  }
}
