{"affected":{"claims":[],"metrics":["harness.assertion_failure.count","harness.invariant_violation.count"]},"baselineId":"f1000000-0000-4000-8000-000000000002","claimScope":{"activeBaselineClaim":false,"performanceClaim":false,"promotionEffectiveClaim":false,"relativeComparisonClaim":false,"runnerQualificationClaim":false,"trustedProvenanceClaim":false},"compatibility":{"cellFingerprint":"fixture-not-a-qualified-cell","closureFingerprint":"fixture-closure-0001","evaluatorGeneration":1,"harnessFingerprint":"fixture-harness-0001","metricRegistryGeneration":1,"policyGeneration":1,"profileId":"fixture.tier_0.local","targetId":"fixture.target.local","toolchainFingerprint":"fixture-toolchain-0001","workloadId":"fixture.workload.local"},"headroom":{"absolute":[{"margin":{"scaleExponent":0,"value":0},"metricId":"harness.assertion_failure.count"}],"relative":[]},"predecessor":{"chain":[{"byteLength":2048,"digest":"sha256:22222222222222222222222222222222222222222222222222222222222222b2","mediaType":"application/vnd.rawframe.evidence.baseline-record.v1+json"}],"descriptor":{"byteLength":2048,"digest":"sha256:22222222222222222222222222222222222222222222222222222222222222b2","mediaType":"application/vnd.rawframe.evidence.baseline-record.v1+json"}},"promoted":{"aggregateVerdict":"passed","evaluationReceipt":{"byteLength":3785,"digest":"sha256:aa2a1b98c4296ab5b444d3a97a7484743af66f78d1b42f403c41e72eb0b13811","mediaType":"application/vnd.rawframe.evidence.evaluation-receipt.v1+json"},"evidenceSet":{"byteLength":1024,"digest":"sha256:11111111111111111111111111111111111111111111111111111111111111a1","mediaType":"application/vnd.rawframe.evidence.evidence-set.v1+json"}},"promotion":{"approvalAuthority":"project_owner","approvalTimestamp":"2026-07-29T00:00:00Z","approvingProjectOwner":"fixture-project-owner","protectedChangeReference":"fixture-protected-change-0001","reason":"Fixture only. This record exists so a reader can be tested and promotes nothing.","reviewReference":"fixture-protected-review-0001"},"recordKind":"baseline_record","retention":{"attachmentsRetainedUntil":"2028-07-29T00:00:00Z","reviewBy":"2027-07-29T00:00:00Z"},"role":"anchor","schemaVersion":1,"source":{"buildFingerprint":"fixture-build-0001","closureFingerprint":"fixture-closure-0001","revision":"fixture-candidate-revision-0001"},"status":{"state":"superseded","successor":{"byteLength":2048,"digest":"sha256:33333333333333333333333333333333333333333333333333333333333333c3","mediaType":"application/vnd.rawframe.evidence.baseline-record.v1+json"}},"tier":"tier_0","trust":{"provenance":"diagnostic_untrusted","reference":"fixture-local-developer"}}