{"affected":{"claims":[],"metrics":["fixture.metric_0","fixture.metric_1","fixture.metric_2","fixture.metric_3","fixture.metric_4","fixture.metric_5","fixture.metric_6","fixture.metric_7","fixture.metric_8","fixture.metric_9","fixture.metric_10","fixture.metric_11","fixture.metric_12","fixture.metric_13","fixture.metric_14","fixture.metric_15","fixture.metric_16","fixture.metric_17","fixture.metric_18","fixture.metric_19","fixture.metric_20","fixture.metric_21","fixture.metric_22","fixture.metric_23","fixture.metric_24","fixture.metric_25","fixture.metric_26","fixture.metric_27","fixture.metric_28","fixture.metric_29","fixture.metric_30","fixture.metric_31","fixture.metric_32","fixture.metric_33","fixture.metric_34","fixture.metric_35","fixture.metric_36","fixture.metric_37","fixture.metric_38","fixture.metric_39","fixture.metric_40","fixture.metric_41","fixture.metric_42","fixture.metric_43","fixture.metric_44","fixture.metric_45","fixture.metric_46","fixture.metric_47","fixture.metric_48","fixture.metric_49","fixture.metric_50","fixture.metric_51","fixture.metric_52","fixture.metric_53","fixture.metric_54","fixture.metric_55","fixture.metric_56","fixture.metric_57","fixture.metric_58","fixture.metric_59","fixture.metric_60","fixture.metric_61","fixture.metric_62","fixture.metric_63"]},"baselineId":"f1000000-0000-4000-8000-000000000001","claimScope":{"activeBaselineClaim":false,"performanceClaim":false,"promotionEffectiveClaim":false,"relativeComparisonClaim":false,"runnerQualificationClaim":false,"trustedProvenanceClaim":false},"compatibility":{"cellFingerprint":"fixture-not-a-qualified-cell","closureFingerprint":"fixture-closure-0001","evaluatorGeneration":1,"harnessFingerprint":"fixture-harness-0001","metricRegistryGeneration":1,"policyGeneration":1,"profileId":"fixture.tier_0.local","targetId":"fixture.target.local","toolchainFingerprint":"fixture-toolchain-0001","workloadId":"fixture.workload.local"},"headroom":{"absolute":[],"relative":[]},"predecessor":{"firstBaseline":true},"promoted":{"aggregateVerdict":"passed","evaluationReceipt":{"byteLength":3785,"digest":"sha256:aa2a1b98c4296ab5b444d3a97a7484743af66f78d1b42f403c41e72eb0b13811","mediaType":"application/vnd.rawframe.evidence.evaluation-receipt.v1+json"},"evidenceSet":{"byteLength":1024,"digest":"sha256:11111111111111111111111111111111111111111111111111111111111111a1","mediaType":"application/vnd.rawframe.evidence.evidence-set.v1+json"}},"promotion":{"approvalAuthority":"project_owner","approvalTimestamp":"2026-07-29T00:00:00Z","approvingProjectOwner":"fixture-project-owner","protectedChangeReference":"fixture-protected-change-0001","reason":"Fixture only. This record exists so a reader can be tested and promotes nothing.","reviewReference":"fixture-protected-review-0001"},"recordKind":"baseline_record","retention":{"attachmentsRetainedUntil":"2028-07-29T00:00:00Z","reviewBy":"2027-07-29T00:00:00Z"},"role":"anchor","schemaVersion":1,"source":{"buildFingerprint":"fixture-build-0001","closureFingerprint":"fixture-closure-0001","revision":"fixture-candidate-revision-0001"},"status":{"state":"active"},"tier":"tier_0","trust":{"provenance":"diagnostic_untrusted","reference":"fixture-local-developer"}}